Course Name,Course Description,Course Link,Course Provider,Course Duration,Course Pricing
Beginning Custom Projects with Raspberry Pi,"In this course you will use a Raspberry Pi 4 to build a complete network-connected project with sensors and motors and access it from your smartphone. We'll explore all the parts which make this work, so you can use this experience as a foundation for yo…",/course/beginning-custom-projects-with-raspberry-pi-110654,Coursera,"14 hours worth of material, 4 weeks long",Free Online Course (Audit)
Evidence-based Toxicology,"Welcome to the Evidence-based Toxicology (EBT) course. In medicine and healthcare, evidence-based medicine has revolutionized the way that information is evaluated transparently and objectively. Over the past ten years, a movement in North America and Eu…",/course/evidence-based-toxicology-12316,Coursera,"20 hours worth of material, 7 weeks long",Free Online Course (Audit)
Excellence in Online Teaching,This course is aimed at anyone who is teaching online or will be in the future.  Learners will come away with ways to improve their online courses and teaching practices today.,/course/excellence-in-online-teaching-119183,Coursera,"11 hours worth of material, 5 weeks long",Free Online Course (Audit)
Principles of Management,"Team leads, managers, and entrepreneurs must juggle team citizenship and leadership, ethics, strategy, and projects with their work in their area of expertise. 
While an individual contributor's success may depend on their own direct input -- the sweat o…",/course/principles-of-management-60072,Coursera,"16 hours worth of material, 4 weeks long",Free Online Course (Audit)
Calculus through Data & Modelling: Integration Applications,"This course continues your study of calculus by focusing on the applications of integration. The applications in this section have many common features.  First, each is an example of a quantity that is computed by evaluating a definite integral.  Second,…",/course/calculus-through-data-and-modelling-integration-a-32769,Coursera,"5-6 hours worth of material, 4 weeks long",Free Online Course (Audit)
ERPO: A Civil Approach to Gun Violence Prevention Teach-Out,Evidence shows that 1 life is saved for every 10-20 Extreme Risk Protection Orders (ERPOs) issued. ERPOs are legally issued civil orders that allow people on the front lines to ask a court to prevent a person at imminent risk of harm to themselves or oth…,/course/erpo-22041,Coursera,"4-5 hours worth of material, 2 weeks long",Free Online Course (Audit)
Gestion de l'analyse des données,"Ce cours d'une semaine décrit le processus d'analyse des données ainsi que la manière de gérer ce processus. Nous décrivons la nature répétitive de l'analyse des données et le rôle de la formulation d'une question précise, l'analyse exploratoire des donn…",/course/managing-data-analysis-fr-39479,Coursera,"8-9 hours worth of material, 1 week long",Free Online Course (Audit)
A Public Health Approach to Hearing Loss and Aging,"At the Johns Hopkins Cochlear Center for Hearing and Public Health, we are dedicated to training up the next generation of clinicians and researchers to study the impact that hearing loss in older adults has on public health and to develop and implement…",/course/a-public-health-approach-to-hearing-loss-and-agin-74666,Coursera,"2-3 hours worth of material, 1 week long",Free Online Course (Audit)
CUDA at Scale for the Enterprise,"This course will aid in students in learning in concepts that scale the use of GPUs and the CPUs that manage their use beyond the most common consumer-grade GPU installations. They will learn how to manage asynchronous workflows, sending and receiving ev…",/course/cuda-at-scale-for-the-enterprise-89907,Coursera,"29 hours worth of material, 5 weeks long",Free Online Course (Audit)
Algebra: Elementary to Advanced - Polynomials and Roots,"This course is the final course in a three part algebra sequence, In this course, students extend their knowledge of more advanced functions, and apply and model them using both algebraic and geometric techniques.  This course enables students to make lo…",/course/polynomials-roots-44577,Coursera,"9-10 hours worth of material, 5 weeks long",Free Online Course (Audit)
Designing Hardware for Raspberry Pi Projects,"This is course 4 of this specialization (although it can be taken out of order) and focuses on applying experience and knowledge gained in the first three courses to build physical electronics hardware. Specifically, this course focuses on four areas: ci…",/course/designing-hardware-for-raspberry-pi-projects-110653,Coursera,"10 hours worth of material, 4 weeks long",Free Online Course (Audit)
CUDA Advanced Libraries,"This course will complete the GPU specialization, focusing on the leading libraries distributed as part of the CUDA Toolkit. Students will learn how to use CuFFT, and linear algebra libraries to perform complex mathematical computations. The Thrust libra…",/course/cuda-advanced-libraries-89908,Coursera,"25 hours worth of material, 5 weeks long",Free Online Course (Audit)
Point of Care Testing for Sexually Transmitted Infections,"What are sexually transmitted infections (STIs), and why do we care? What is point of care testing (POCT)? What do clinicians and patients want and need from the POCT for STIs? 

Point of care testing, or medical diagnostic testing done at the time of pa…",/course/poct-for-sti-56223,Coursera,"6-7 hours worth of material, 4 weeks long",Free Online Course (Audit)
Cours intensif sur la science des données,Vous avez sûrement déjà entendu parler de la science des données et du Big Data. Ce cours intensif d'une semaine vous permettra de comprendre ce que ces termes signifient et comment ils jouent un rôle dans les entreprises prospères. Ce cours intensif s'a…,/course/data-science-course-fr-39514,Coursera,"6-7 hours worth of material, 1 week long",Free Online Course (Audit)
Taking Safety and Quality Improvement Work to the Next Level (Patient Safety VII),"In this culminating course in the Patient Safety and Quality Improvement Specialization, you will apply the skills you have acquired across the previous six courses to address a realistic patient safety issue confronting Mercy Grace, a 500-bed urban hosp…",/course/patient-safety-capstone-9773,Coursera,"8-9 hours worth of material, 5 weeks long",Free Online Course (Audit)
Teaching Reluctant Writers,All educators will encounter students who struggle with writing. This course first focuses on the reasons student writers may be reluctant and then provides learners with a variety of strategies and practices to help reluctant writers develop a greater c…,/course/teaching-reluctant-writers-45184,Coursera,"15 hours worth of material, 3 weeks long",Free Online Course (Audit)
Teaching Texts and Forms,"The first job of any writer is to get words down on paper, and teaching writing as process helps students gain the fluency, comfort and confidence they need to succeed at any writing task. But complex, comprehensive writing tasks often bring with them sp…",/course/teaching-texts-forms-45186,Coursera,"21 hours worth of material, 4 weeks long",Free Online Course (Audit)
Kids with Cancer Still Need School: The Providers Role,This course will help you understand and address the challenges parents and families face regarding schooling after a cancer diagnosis.,/course/kids-with-cancer-still-need-school-providers-role-36559,Coursera,"2-3 hours worth of material, 5 weeks long",Free Online Course (Audit)
The Ethical Leader,"This aims primarily at post-baccalaureate students interested in leadership theory and ethical leadership. 

The first part of this course introduces students to the classical literature in philosophical ethics, including consequentialist, regularian, de…",/course/the-ethical-leader-110367,Coursera,"56 hours worth of material, 5 weeks long",Free Online Course (Audit)
Technology and Product Planning,"Through the voices of start-up and product leaders this course makes transparent what it takes to build a digital health product for healthcare customers large and small. It outlines the planning, resources, process, and team needed to get a healthcare t…",/course/technology-and-product-planning-66067,Coursera,"6-7 hours worth of material, 4 weeks long",Free Online Course (Audit)
"Responding, Revising and Assessing Student Writings","When writers write, readers respond. Responding to student writing gives teachers one of the most meaningful avenues to help students learn and grow. In this module, learners will identify best practices in effectively responding to student writing. You…",/course/responding-revising-assessing-student-writings-45185,Coursera,"21 hours worth of material, 4 weeks long",Free Online Course (Audit)
Culminating Project in Health Informatics,"This capstone course in the Health Informatics Specialization will allow learners to create a comprehensive plan for an informatics intervention of their choosing, and that will demonstrate to current or future employers the new skills obtained through t…",/course/culminating-project-course-in-health-inf-12854,Coursera,"14 hours worth of material, 4 weeks long",Free Online Course (Audit)
Household Surveys for Program Evaluation in LMICs,"This course provides an introduction to household surveys for program evaluation in low-and middle-income countries. The course will equip you with skills to:
1. Explain what coverage is, why it's important in evaluations, and how it is measured
2. Descr…",/course/household-surveys-for-program-evaluation-56222,Coursera,"167 hours worth of material, 6 weeks long",Free Online Course (Audit)
The Persuasive Leader,"This aims primarily at post-baccalaureate students interested in leadership theory.

The course has four modules. Module 1 introduces students to agile leadership as (a) a logical sequel to adaptive and team leadership, and (b) the foundation of contempo…",/course/the-persuasive-leader-110366,Coursera,"40 hours worth of material, 4 weeks long",Free Online Course (Audit)
Opioid Epidemic: From Evidence to Impact,"While prescription opioids serve an invaluable role for the treatment of cancer pain and pain at the end of life, their overuse for acute and chronic non-cancer pain as well as the increasing availability of heroin and illicit fentanyl, have contributed…",/course/opioid-epidemic-17143,Coursera,"7-8 hours worth of material, 4 weeks long",Free Online Course (Audit)
Using Sensors With Your Raspberry Pi,"This course on integrating sensors with your Raspberry Pi is course 3 of a Coursera Specialization and can be taken separately or as part of the specialization. Although some material and explanations from the prior two courses are used, this course larg…",/course/using-sensors-with-your-raspberry-pi-110656,Coursera,"8-9 hours worth of material, 4 weeks long",Free Online Course (Audit)
데이터 과학자의 도구 상자,"이 과정에서는 데이터 과학자의 도구 상자에 있는 메인 도구와 아이디어를 소개합니다. 본 과정은 데이터 분석가와 데이터 과학자가 작업하는 데이터, 질문 및 도구의 개요에 대해 설명합니다. 이 과정에는 두 가지 구성 요소가 있습니다. 첫 번째는 데이터를 실행 가능한 지식으로 바꾸는 아이디어에 대한 개념적 소개입니다. 두 번째는 버전 관리, 마크다운, git, GitHub, R 및 RStudio와 같은 프로그램에서 사용할 도구에 대한 실용적인 소개입니다.",/course/data-scientists-tools-ko-60063,Coursera,"18 hours worth of material, 4 weeks long",Free Online Course (Audit)
Communications and High-Speed Signals with Raspberry Pi,"Course two of this specialization is all about hardware physical layer and communication between elements of your project, how to troubleshoot high-speed signals when they don't work, and how to design your projects so they do work. 

We start with a rev…",/course/communications-and-high-speed-signals-with-raspbe-110657,Coursera,"13 hours worth of material, 4 weeks long",Free Online Course (Audit)
Teaching Writing Final Project,"One of the goals of the Teaching Writing specialization has been to help every learner consider ways to adapt what they are learning and apply it to their specific situation, needs and interests. The theories, strategies and practices presented in these…",/course/teaching-writing-final-project-45183,Coursera,"22 hours worth of material, 4 weeks long",Free Online Course (Audit)
R 프로그래밍,"이 과정에서는 R로 프로그래밍하는 방법과 효과적인 데이터 분석을 위해 R을 사용하는 방법을 배웁니다. 통계 프로그래밍 환경에 필요한 소프트웨어를 설치 및 구성하는 방법과 고급 통계 언어로 구현되는 일반적인 프로그래밍 언어 개념을 설명합니다. 이 과정은 R 프로그래밍, R로 데이터 읽기, R 패키지 액세스, R 함수 작성, 디버깅, R 코드 프로파일링, R 코드 구성 및 주석 달기를 포함하는 통계 컴퓨팅의 실제 문제를 다룹니다. 통계 데이터 분석의 주제…",/course/r-programming-ko-60066,Coursera,"59 hours worth of material, 4 weeks long",Free Online Course (Audit)
The Creative Leader,"This aims primarily at post-baccalaureate students interested in leadership theory.

The course has four modules. Module 1 covers definitions and foundations of creative leadership. Topics include, What is creative leadership? Why creative leadership? An…",/course/the-creative-leader-110368,Coursera,"35 hours worth of material, 4 weeks long",Free Online Course (Audit)
Gestión del análisis de datos,"This one-week course describes the process of analyzing data and how to manage that process. We describe the iterative nature of data analysis and the role of stating a sharp question, exploratory data analysis, inference, formal statistical modeling, in…",/course/managing-data-analysis-es-65446,Coursera,"8-9 hours worth of material, 1 week long",Free Online Course (Audit)
Calculus through Data & Modelling: Series and Integration,"This course continues your study of calculus by introducing the notions of series, sequences, and integration.  These foundational tools allow us to develop the theory and applications of the second major tool of calculus: the integral.  Rather than meas…",/course/calculus-through-data-and-modelling-series-and-in-32774,Coursera,"8-9 hours worth of material, 5 weeks long",Free Online Course (Audit)
Calculus through Data & Modelling: Vector Calculus,"This course continues your study of calculus by focusing on the applications of integration to vector valued functions, or vector fields. These are functions that assign vectors to points in space, allowing us to develop advanced theories to then apply t…",/course/calculus-through-data-and-modelling-vector-calcul-32766,Coursera,"4-5 hours worth of material, 3 weeks long",Free Online Course (Audit)
تحليل البيانات الاستكشافية,يغطي هذا المقرر التقنيات الاستكشافية الأساسية لتلخيص البيانات. يتم تطبيق هذه الأساليب عادة قبل أن تبدأ النمذجة الرسمية ويمكن أن تساعد في تطوير نماذج إحصائية أكثر تعقيدًا. تعد التقنيات الاستكشافية مهمة أيضًا لإزالة أو شحذ الفرضيات المحتملة حول العالم التي ي…,/course/exploratory-data-analysis-ar-39395,Coursera,"57 hours worth of material, 4 weeks long",Free Online Course (Audit)
Ein Crashkurs in Datenwissenschaft,"Inzwischen haben Sie sicher schon von Datenwissenschaft und Big Data gehört. In diesem einwöchigen Kurs werden wir in einem Crashkurs vermitteln, was diese Begriffe bedeuten und inwiefern sie in erfolgreichen Organisationen eine Rolle spielen. Dieser Kur…",/course/data-science-course-de-39437,Coursera,"6-7 hours worth of material, 1 week long",Free Online Course (Audit)
Introduction to Reproducibility in Cancer Informatics,"The course is intended for students in the biomedical sciences and researchers who use informatics tools in their research and have not had training in reproducibility tools and methods.

This course is written for individuals who:  

- Have some familia…",/course/intro-reproducibility-cancer-informatics-60069,Coursera,"7-8 hours worth of material, 5 weeks long",Free Online Course (Audit)
Calculus through Data & Modelling: Techniques of Integration,"In this course, we build on previously defined notions of the integral of a single-variable function over an interval. Now, we will extend our understanding of integrals to work with functions of more than one variable. First, we will learn how to integr…",/course/calculus-through-data-and-modelling-techniques-of-32771,Coursera,"4-5 hours worth of material, 4 weeks long",Free Online Course (Audit)
Teaching Writing Process,"Half a century ago, a revolution took place in the teaching of writing. Educators asked, “What if we were to study how professional writers wrote, as a way to learn how we might teach writing more effectively?” The result was the writing process movement…",/course/teaching-writing-process-45187,Coursera,"20 hours worth of material, 4 weeks long",Free Online Course (Audit)
Управление анализом данных,"Этот недельный курс описывает процесс анализа данных и способы управления этим процессом. Мы рассмотрим итеративный характер анализа данных и роль постановки точного вопроса, исследовательский анализ данных, выводы, формальное статистическое моделировани…",/course/managing-data-analysis-ru-39512,Coursera,"8-9 hours worth of material, 1 week long",Free Online Course (Audit)
Foundations of Telehealth,"Telemedicine has proven itself to be an important part of the future of healthcare. In this course, students will be introduced to the key components and considerations needed to design and implement a successful telemedicine program at both the practice…",/course/telehealth-60068,Coursera,"8-9 hours worth of material, 4 weeks long",Free Online Course (Audit)
Advanced Reproducibility in Cancer Informatics,This course introduces tools that help enhance reproducibility and replicability in the context of cancer informatics. It uses hands-on exercises to demonstrate in practical terms how to get acquainted with these tools but is by no means meant to be a co…,/course/adv-reproducibility-cancer-informatics-60070,Coursera,"9-10 hours worth of material, 5 weeks long",Free Online Course (Audit)
Embajador de la Vacuna COVID: Cómo Hablar con los Padres,"La vacunación es una estrategia clave para prevenir enfermedades graves y la muerte por COVID-19. Estas vacunas están disponibles para niños de a partir de los 5 años, pero muchos padres tienen preguntas sobre las vacunaciones. Este curso de capacitación…",/course/covid-vaccine-ambassador-spanish-89845,Coursera,"2-3 hours worth of material, 1 week long",Free Online Course (Audit)
Der Werkzeugkasten des Data Scientist,"In this course you will get an introduction to the main tools and ideas in the data scientist's toolbox. The course gives an overview of the data, questions, and tools that data analysts and data scientists work with. There are two components to this cou…",/course/data-scientists-tools-de-65146,Coursera,"18 hours worth of material, 4 weeks long",Free Online Course (Audit)
Family Spirit Nurture,This course is designed for health educators and home visitors serving families with infants 0-6 months old. Learners will gain knowledge and skills to make a positive impact on healthy infant nutrition and growth as well as maternal and family nutrition…,/course/family-spirit-nurture-126832,Coursera,"6-7 hours worth of material, 4 weeks long",Free Online Course (Audit)
Data Science in Real Life,Have you ever had the perfect data science experience? The data pull went perfectly. There were no merging errors or missing data. Hypotheses were clearly defined prior to analyses. Randomization was performed for the treatment of interest. The analytic…,/course/real-life-data-science-4389,Coursera,"7-8 hours worth of material, 1 week long",Free Online Course (Audit)
Principles of fMRI 1,"This course covers the design, acquisition, and analysis of Functional Magnetic Resonance Imaging (fMRI) data.

A book related to the class can be found here: https://leanpub.com/principlesoffmri",/course/fmri1-4397,Coursera,"8-9 hours worth of material, 4 weeks long",Free Online Course (Audit)
Managing Data Analysis,"This one-week course describes the process of analyzing data and how to manage that process. We describe the iterative nature of data analysis and the role of stating a sharp question, exploratory data analysis, inference, formal statistical modeling, in…",/course/managing-data-analysis-4388,Coursera,"8-9 hours worth of material, 1 week long",Free Online Course (Audit)
Principles of fMRI 2,"This course covers the analysis of Functional Magnetic Resonance Imaging (fMRI) data. It is a continuation of the course “Principles of fMRI, Part 1”",/course/fmri2-4814,Coursera,"8-9 hours worth of material, 4 weeks long",Free Online Course (Audit)
"Living with Dementia: Impact on Individuals, Caregivers, Communities and Societies","Health professionals and students, family caregivers, friends of and affected individuals, and others interested in learning about dementia and quality care will benefit from completing the course. Led by Drs. Nancy Hodgson and Laura Gitlin, participants…",/course/dementiacare-1030,Coursera,"18 hours worth of material, 5 weeks long",Free Online Course (Audit)
Understanding Cancer Metastasis,"Over 500,000 people in the United States and over 8 million people worldwide are dying from cancer every year. As people live longer, the incidence of cancer is rising worldwide, and the disease is expected to strike over 20 million people annually by 20…",/course/cancer-metastasis-7624,Coursera,"5-6 hours worth of material, 3 weeks long",Free Online Course (Audit)
An Introduction to the U.S. Food System: Perspectives from Public Health,"A food system encompasses the activities, people and resources involved in getting food from field to plate. Along the way, it intersects with aspects of public health, equity and the environment. In this course, we will provide a brief introduction to t…",/course/foodsys-396,Coursera,"24 hours worth of material, 6 weeks long",Free Online Course (Audit)
Design and Interpretation of Clinical Trials,"Clinical trials are experiments designed to evaluate new interventions to prevent or treat disease in humans. The interventions evaluated can be drugs, devices (e.g., hearing aid), surgeries, behavioral interventions (e.g., smoking cessation program), co…",/course/clintrials-1037,Coursera,"10 hours worth of material, 6 weeks long",Free Online Course (Audit)
Fighting COVID-19 with Epidemiology: A Johns Hopkins Teach-Out,This free Teach-Out is for anyone who has been curious about how we identify and measure outbreaks like the COVID-19 epidemic and wants to understand the epidemiology of these infections.,/course/covid19-epidemiology-19250,Coursera,"4-5 hours worth of material, 2 weeks long",Free Online Course (Audit)
Systems Thinking In Public Health,"This course provides an introduction to systems thinking and systems models in public health. Problems in public health and health policy tend to be complex with many actors, institutions and risk factors involved. If an outcome depends on many interacti…",/course/systems-thinking-5723,Coursera,"15 hours worth of material, 4 weeks long",Free Online Course (Audit)
Data Science,"Ask the right questions, manipulate data sets, and create visualizations to communicate results.

This Specialization covers the concepts and tools you'll need throughout the entire data science pipeline, from asking the right kinds of questions to makin…",/course/jhu-data-science-18692,Coursera,"7 hours a week, 48 weeks long",Paid Course
The Unix Workbench,"Unix forms a foundation that is often very helpful for accomplishing other goals you might have for you and your computer, whether that goal is running a business, writing a book, curing disease, or creating the next great app. The means to these goals a…",/course/unix-8866,Coursera,"19 hours worth of material, 4 weeks long",Free Online Course (Audit)
Data and Health Indicators in Public Health Practice,"Epidemiology in public health practice uses study design and analyses to identify causes in an outbreak situation, guides interventions to improve population health, and evaluates programs and policies.

In this course, we'll introduce you to problem sol…",/course/data-public-health-8921,Coursera,"6-7 hours worth of material, 4 weeks long",Free Online Course (Audit)
Measuring and Maximizing Impact of COVID-19 Contact Tracing,"This course aims to provide managers and developers of contact tracing programs guidance on the most important indicators of performance of a contact tracing program, and a tool that can be used to project the likely impact of improvements in specific in…",/course/measuring-and-maximizing-impact-of-covid-19-conta-20985,Coursera,"3-4 hours worth of material, 1 week long",Free Online Course (Audit)
